post_id,post_date,group,author,content
591,2017-08-21,17,youralterego,MIT is a very impressive looking school I'm bored most of the time.
592,2018-12-21,2,viperfish12,"Stupid UCLA, deserves a good poking.."
593,2017-09-08,4,artykom,I love Harvard Square in the fall.
594,2016-12-21,13,alex945,i wouldnt really recommend uk anymore i hate london.
595,2017-01-06,3,alex945,Awesome diner here @ Purdue...
596,2019-01-29,5,cracking12345,"I think Angelina Jolie is so much more beautiful than Jennifer Anniston, who, by the way, is majorly OVERRATED."
597,2015-03-18,18,sudebala,So i hate american express cards....
598,2017-07-29,NULL,sudebala,Which makes me think I need AAA more than AA...
599,2018-11-10,18,maharnav,i love seattle so much.
600,2019-06-10,8,hassan1365416,i hate seattle.
601,2016-07-09,2,sheik_yerbouti,I love Paris Hilton to the max now...
602,2016-01-24,NULL,cracking12345,"I love Angelina Jolie and i love you even more, also your music on your site is my fav."
603,2019-03-27,20,cracking12345,I really like the Geico commercials with the australian sounding gecko.
604,2018-11-02,4,maharnav,I hate Paris Hilton.
605,2015-06-03,NULL,fsv,harvard is for dumb people.
606,2015-05-15,8,jerusseust,That SouthWest airlines is amazing.
607,2015-05-19,20,nitsua49,I absolutely love my MacBook Pro.
608,2018-05-19,19,sheik_yerbouti,"Well, my job at GEICO has been great so far."
609,2019-03-14,7,citrus2014,I love Angelina Jolie.
610,2017-11-21,19,cracking12345,"I should remind that self that my boring green'96 Toyota Camry has 230k on the odometer, hasn't been to get a tune-up in over a year -- poor thing;"
611,2019-09-05,10,odalv,I prefer my Visa or Mastercard because it is accepted in more places...
612,2016-04-18,11,citrus2014,As I continue to look for help on bearing New England winters my awesome MIT friends sent me the following link.
613,2018-01-25,15,tahastanly,"If that indicates your disinterest in Seattle, that sucks, and I'm sorry, but frankly I can't luckin wait to have you back."
614,2017-03-31,18,sosobanane,"When Emmy was in town, I told her ( in a moment of pure physical pain as we hiked up to the Lombard / Leavenworth intersection ) that San Francisco is always halfway between fantastic and miserable."
615,2016-06-04,NULL,stethoscopes,We talked about your happy BU days and your boring / frustrating'Citi'days...
616,2016-07-12,10,f1984b,Give those beautiful boys at MIT whatever they need.
617,2017-11-19,14,craciun05,"I can only imagine, with the bloated egos and arrogant liberalism at Harvard, this effect was magnified..."
618,2017-02-23,NULL,sosobanane,he loves NYC too much in my opinion ( because i'll always love my seattle too much )...
619,2016-02-28,14,f1984b,i love angelina jolie.
620,2015-06-20,9,mmarvin,#NAME?
621,2018-01-09,1,jerusseust,I love San Francisco...
622,2017-06-19,9,sosobanane,Now I can totally rub it in my dad's face that Seattle sucks more than Pittsburgh does.
623,2018-04-21,11,amateur07,The Lakers can suck me...
624,2015-09-13,19,sheik_yerbouti,"Angelina Jolie is a perfect example of the combination of large eyes, large lips, good skin, and a symmetrical face."
625,2015-06-04,6,fsv,I LOVE Seattle!!
626,2015-03-21,NULL,bischopscup,I have loved Tom Cruise since Risky Business...
627,2015-08-04,11,piley159,I love the lakers.
628,2018-05-11,10,amateur07,ugly but durable ThinkPad.
629,2019-01-19,8,harmon758,I love Tom Cruise.
630,2015-04-10,NULL,craciun05,I didn't get EA at MIT which was very disappointing.
631,2016-06-09,NULL,harmon758,i like the lakers.
632,2015-06-04,14,sosobanane,angelina jolie is so beautiful that i don't even have the desire to attain such exquisite beauty..
633,2016-01-12,9,maharnav,"n metti wa gor wait me end up the ce,. then we hv dinner ga..... i love u galz say "" wait me "" aaa."
634,2017-10-02,NULL,craciun05,brad pitt because i hate tom cruise.
635,2019-04-21,NULL,aminox,I absolutely love my MacBook Pro.
636,2015-04-11,6,nitsua49,I miss London...
637,2019-02-05,13,youralterego,I liked Tom Cruise until he dumped Nicole Kidman.
638,2017-07-19,7,aminox,stupid UCLA..
639,2016-05-12,15,harmon758,I LOVE SEATTLE.
640,2017-06-23,10,youralterego,I hate Tom Cruise..
641,2019-10-09,1,artykom,"I mean we were never EXCLUSIVE, but I like to think Purdue and I were seriously talking on our way to dating..."
642,2019-10-19,15,cracking12345,I have loved Tom Cruise since Risky Business...
643,2018-05-25,NULL,odalv,", they have this song and durring it, everyone yells "" UCLA sucks!"
644,2018-07-11,18,artykom,i try to enjoy my time here in san francisco.......
645,2017-03-17,6,odalv,And I love old school Chicago Bulls...
646,2019-05-15,18,f1984b,had to pay 24 $ cause aaa SUCKS!!!........
647,2015-09-26,3,amateur07,I HATE LONDON!..
648,2016-03-21,19,nitsua49,I love the lakers even tho Trav makes fun of me.
649,2017-04-03,1,piley159,"if i finish law here at USF or at some other place, like Harvard."
650,2019-07-30,NULL,alex945,Funny that harvard was almost more stressful than MY AUDITION!
651,2016-06-28,9,harmon758,actually the only thing that i really like about purdue is my apartment....
652,2016-11-01,NULL,rps_1899,and i blame angelina jolie!
653,2019-08-28,2,rexlex,i love my macbook...
654,2019-01-01,7,hassan1365416,"Traffic in Seattle does stink, but it's a beautiful city to be stuck in."
655,2019-04-07,NULL,rps_1899,MIT was amazing.
656,2019-04-13,NULL,sudebala,Now I can totally rub it in my dad's face that Seattle sucks more than Pittsburgh does.
657,2016-04-12,5,sheik_yerbouti,AMERICAN AIRLINES SUCKS...
658,2015-01-20,19,f1984b,I still like Tom Cruise.
659,2017-09-17,NULL,sosobanane,I loved Boston and MIT so much and still do.
660,2016-04-07,2,hairy-conniption,"Honda is calling back some 423,344 vehicles in its home market of Japan over faulty key interlocks which allow keys to be removed from the ignition when the gearshift is in positions other than'park."
661,2018-06-02,11,sudebala,Now I'm walking around looking like the ugliest person in the world angelina jolie!!!!!!!
662,2019-09-27,NULL,cracking12345,I like Tom Cruise and will boycott Paramount Pictures..
663,2017-07-31,3,amateur07,"I'm so glad I love Paris Hilton, too, or this would be excruciating."
664,2018-04-26,8,bischopscup,i went to look into the details about my graduation gear and when i came back my beautiful blue toyota PASS got a ticket for being 5 min.
665,2015-09-10,15,sheik_yerbouti,gawssh i hate london i hope he blows up and his guts fly everywhere and then birds eat his guts.
666,2019-05-30,8,timequake,I want to visit Seattle and see what it's like up there because I just love Seattle.
667,2018-09-06,8,mmarvin,ur making me hungry and worse ur makin me miss london sooooooooooo much!.
668,2019-09-13,NULL,odalv,anyways i loved beijing as much as i loved shanghai.
669,2018-12-05,20,nitsua49,"Though I want a Vios / Honda Jazz badly, I think I'll be fine in a 2nd hand Myvi or Waja or Gen 2 or anything decent."
670,2018-09-20,5,timequake,the Hyundai ones are excellent)!..
671,2019-05-22,NULL,cracking12345,angelina jolie is so beautiful that i don't even have the desire to attain such exquisite beauty..
672,2017-03-16,5,fsv,Purdue's campus sucks in comparison.
673,2016-12-12,NULL,stethoscopes,I LOVE SHANGHAI!!!!!
674,2019-01-16,7,sheik_yerbouti,I LOVE YOU NA ATA PUTRAGIS!..
675,2017-08-23,12,jerusseust,i love my macbook...
676,2016-11-24,NULL,maharnav,he loves NYC too much in my opinion ( because i'll always love my seattle too much )...
677,2016-10-10,3,viperfish12,"I can only imagine, with the bloated egos and arrogant liberalism at Harvard, this effect was magnified..."
678,2017-01-27,NULL,cracking12345,Why I LOVE Seattle.
679,2016-11-01,17,nitsua49,I love Boston too!
680,2016-01-03,NULL,mohamadi46,I hate Paris Hilton.
681,2015-05-15,17,rps_1899,I think it's pretty clear Angelina Jolie is an ignorant racist.
682,2017-10-28,14,craciun05,"Though I want a Vios / Honda Jazz badly, I think I'll be fine in a 2nd hand Myvi or Waja or Gen 2 or anything decent."
683,2016-09-15,2,f1984b,"She also said she didnt miss her Thanksgiving because Geico was so great and he goes "" MASHED POTATOES AND CRANBERRY SAUCE!!!!"
684,2016-01-24,3,mohamadi46,Oppose Hillary Clinton and all evil doing evil doers everywhere!!!
685,2015-11-10,1,mmarvin,"The only consolation is that most ivy league schools, including Harvard, produce about 75 % losers, so I'm not alone."
686,2018-02-04,NULL,artykom,"Today, when Monkee was backing out of the Milpitas Library's parking lot, some old asian man driving a Toyota was driving the wrong way."
687,2016-11-13,5,odalv,Harvard kicks ass.
688,2016-09-02,5,viperfish12,"Today, when Monkee was backing out of the Milpitas Library's parking lot, some old asian man driving a Toyota was driving the wrong way."
689,2017-12-13,NULL,artykom,I hate Tom Cruise..
690,2017-08-23,15,cracking12345,i love seattle..
691,2015-04-13,NULL,sosobanane,i love shanghai too =).
692,2019-12-09,15,rps_1899,I hate Paris Hilton.
693,2015-07-04,4,sudebala,"Then I need to look for new insurance, since AAA was an evil asshat and upped my rate, despite the fact I've been with them since 198lucking7."
694,2016-10-19,NULL,maharnav,"I love shanghai because I am from Shanghai, wherever in the world you can find Shanghairen.."
695,2015-12-23,20,amateur07,I needed San Francisco but not until a month ago.
696,2016-07-07,15,artykom,I LOVE SEATTLE.
697,2017-12-14,NULL,sudebala,I love Boston too!
698,2016-11-07,9,f1984b,All san Francisco has are shitty little old apts in this price range...
699,2016-12-23,13,odalv,i hate volkswagen..
700,2017-06-08,6,bischopscup,"harvard is dumb, i mean they really have to be stupid to have not wanted her to be at their school."
701,2016-08-13,10,hairy-conniption,BOSTON SUCKS!!!
702,2019-02-19,16,fsv,"I've always liked the Clipperships on the side, but I absolutely LOVE the Lakers, there's a huge difference."
703,2016-11-14,2,youralterego,I love the new Geico commercials with the celebrities..
704,2015-03-28,15,tahastanly,Then we had stupid trivia about San Francisco and sci fi tv so we left...
705,2016-10-18,18,amateur07,boston college is good too < 33.
706,2018-10-11,5,viperfish12,"i think if i hate boston, ill just disappear to california for the summers..."
707,2018-08-17,6,harmon758,"I miss Boston so much it hurts sometimes, but I know that I'm really just missing this time of my life and the people from it..."
708,2016-09-12,16,youralterego,Boston SUCKS.
709,2017-08-05,13,tahastanly,"besides, UCLA was a stupid dream..."
710,2018-09-22,15,hassan1365416,actually the only thing that i really like about purdue is my apartment....
711,2015-10-06,15,alex945,i hate paris hilton..
712,2019-11-27,9,tahastanly,I love Tom Cruise!
713,2015-05-28,8,citrus2014,"I think Angelina Jolie is so much more beautiful than Jennifer Anniston, who, by the way, is majorly OVERRATED."
714,2019-01-30,20,odalv,PARIS HILTON SUCKS!
715,2019-08-31,11,harmon758,I LIKE PARIS HILTON AND I WOULD JOIN HER OFFICIAL FAN CLUB.
716,2016-11-08,16,f1984b,miss you aaa ~..
717,2015-08-04,NULL,maharnav,", Boston is great..."
718,2016-4-31,15,jerusseust,"Anyway, some crappy Honda, but, as is young peoples'customs, it has a good $ 2 million worth of sound equipment inside."
719,2015-09-09,5,stethoscopes,"I think Angelina Jolie is so much more beautiful than Jennifer Anniston, who, by the way, is majorly OVERRATED."
720,2018-07-17,16,artykom,i love seattle..
721,2018-6-31,12,rexlex,but i love harvard.
722,2015-2-30,10,viperfish12,I love Tom Cruise.
723,2016-12-11,20,timequake,"n metti wa gor wait me end up the ce,. then we hv dinner ga..... i love u galz say "" wait me "" aaa."
724,2018-11-06,9,alex945,After that I peaced out avec Kalvis and we had a drunken dance party in my room and took stupid macbook webcam photos ( in which I will post in a second ).
725,2017-08-28,19,alex945,"I definitely slept in my coat, but I slept really comfortably, because I had my awesome purdue blanket my mommy made me, and my own pillow....."
726,2019-07-29,18,timequake,Boston can suck my lucking cuticless...
727,2015-10-09,NULL,rexlex,"Though I want a Vios / Honda Jazz badly, I think I'll be fine in a 2nd hand Myvi or Waja or Gen 2 or anything decent."
728,2016-05-24,1,tahastanly,I told her that UCLA is excellent for both...
729,2015-10-13,9,sudebala,"i think if i hate boston, ill just disappear to california for the summers..."
730,2016-10-07,NULL,youralterego,Seattle sucks in bumper to bumper if you're on a hill with a stick shift.
731,2015-07-26,15,harmon758,I hate Seattle..
732,2016-02-25,13,harmon758,I need some of that geico balboa stuff..
733,2017-05-17,1,craciun05,"I'm a big fan of Lakers, so I kind of have all the schedule for this season which it's end in april..."
734,2018-12-01,18,hairy-conniption,i also enjoy the citi dividends cars...
735,2015-07-10,20,piley159,"Angelina Jolie says that being self-destructive is selfish and you ought to think of the poor, starving, mutilated people all around the world."
736,2019-02-05,12,nitsua49,stupid kids and their need for Honda emblems):
737,2019-09-13,2,cracking12345,I love Harvard guys...
738,2017-6-31,16,bischopscup,i love the lakers as you can see.
739,2017-06-28,4,aminox,I hate London!!!!!!!
740,2015-10-31,19,rps_1899,Hush. ) I love Boston because I get to hang out with so many friends just this week alone that I'm used to only seeing once or twice a year.
741,2017-07-18,18,mmarvin,"i LOVE san francisco, and i find myself missing it......"
742,2019-01-01,13,cracking12345,miss you aaa ~..
743,2016-03-16,NULL,f1984b,"The history here goes back to the summer of 1992, when the San Francisco Giants were terrible."
744,2019-05-12,6,sosobanane,the beautiful Harvard grad —..
745,2016-12-07,16,youralterego,"By the time I left the Hospital, I had no time to drive to Boston-which sucked because 1)"
746,2018-05-29,NULL,mmarvin,"As the lightening strook and the thunder rolled in the late evening, I drove me and my two buddies, James and Kelly, in my beautiful toyota landcruiser off into the mountains of summerland."
747,2017-06-15,14,piley159,I like living in Seattle again.
748,2015-11-22,8,maharnav,I love Paris Hilton..
749,2017-04-19,4,stethoscopes,"By the way, I hate LONDON..."
750,2019-07-19,NULL,tahastanly,i actually did check my mail and stupid capital one sent me something in one of those puffy package things...
751,2017-03-23,5,stethoscopes,Love Story At Harvard [ awesome drama!
752,2017-07-17,17,mmarvin,I love Tom Cruise!
753,2015-02-26,6,f1984b,"Since then, 25 automakers including Toyota Motor Corp. and Honda Motor Co. have recalled about 370,000 defective vehicles, according to the agency."
754,2015-04-01,18,hassan1365416,I'd love a Toyota van..
755,2015-03-06,10,harmon758,I hate paris hilton too!
756,2017-11-26,NULL,stethoscopes,hell ya i play on 2 basketball teams i love the lakers + pistons love both!!!!..
757,2016-09-03,14,f1984b,I absolutely love my MacBook Pro.
758,2018-08-13,15,odalv,stupid lakers!!!!!!!!!!!
759,2016-9-31,NULL,sosobanane,I love UCLA but miss everyone from back home.
760,2016-04-20,9,citrus2014,there's absolutely no way that this is happening
761,2016-02-20,NULL,tahastanly,I hate Paris Hilton.
762,2017-06-16,NULL,stethoscopes,AAA rocks.
763,2015-06-19,20,rexlex,i try to enjoy my time here in san francisco.......
764,2018-06-22,20,stethoscopes,BOSTON SUCKS!!!
765,2019-08-18,14,stethoscopes,"I love the London Little People, btw."
766,2016-06-05,17,timequake,I HATE LONDON!..
767,2015-11-01,19,rps_1899,"next time you make it, use the corned beef i like na lng * wink * the hereford brand ata..."
768,2015-09-14,18,timequake,"I despise Paris Hilton, but hey, she was finally good for something..."
769,2015-12-18,NULL,mmarvin,"I really, really hate TOM CRUISE."
770,2015-05-22,2,jerusseust,"AAA's "" Q "" is catchy and an ear worm, like many of the things they've done."
771,2018-06-28,7,sudebala,"Along the sides of exit fly-over there were parallel parking spots for "" attractive cars only "" — the sign listed several criteria of which my crappy Honda qualified for none."
772,2018-06-16,10,aminox,I hate the exodus of subarus and honda crv's and volvos.
773,2016-02-04,3,viperfish12,garbage…
774,2019-04-17,14,cracking12345,"I've been working on an article, and Antid Oto has been, er, so upset about the shitty Harvard plagiarizer that he hasn't been able to even look at keyboards."
775,2015-01-01,NULL,timequake,"London yesterday kinda sucked tbh, well, the Houses of Parliament did anyway."
776,2015-04-27,7,f1984b,I like your new macbook...
777,2017-01-01,13,maharnav,anyways i loved beijing as much as i loved shanghai.
778,2016-01-17,20,jerusseust,Funny that harvard was almost more stressful than MY AUDITION!
779,2018-07-31,5,cracking12345,"personally, i still love my 1999 toyota camry, 4 cylinder, 35mpg, gray, comfy, smooth, dependable...."
780,2017-12-07,7,tahastanly,That's why I most love the Harvard story:
781,2015-05-16,19,sudebala,boston is great: ).
782,2017-09-29,NULL,mohamadi46,"lets see, i saw: winter sonata, tree of heaven, and love story in harvard loll..-_ -;;"
783,2018-05-27,8,rexlex,"it has taken forever to figure out where I needed to go to do everything, and it turns out that half the things have to be done in London, which is just great."
784,2018-02-23,18,sheik_yerbouti,Angelina Jolie is beautiful.
785,2017-10-08,14,timequake,I can see why he might have had problems with Karen but Toyota Alexa is useless and Jo is MENTAL!!!
786,2017-07-09,11,stethoscopes,"I like being at Purdue, not with my family."
787,2018-09-07,NULL,aminox,i love mit and harvard both..
788,2017-10-22,NULL,amateur07,AAA is terrible.
789,2015-07-25,2,piley159,I miss Boston a lot.
790,2016-05-23,NULL,stethoscopes,"Oh man, last night's Lakers playoff game was awesome."
791,2017-12-20,15,alex945,lakers suck!
792,2015-11-07,NULL,sheik_yerbouti,"I love this AllState commercial called "" Tailgating "" where I see a bunch of people marching in the streets and tailgaters at a college football game with their barbecue setup near their SUV."
793,2019-06-12,14,aminox,haha i love the geico lizard too!!!
794,2018-06-30,4,alex945,"Stupid UCLA, deserves a good poking.."
795,2016-10-02,5,aminox,"I definitely slept in my coat, but I slept really comfortably, because I had my awesome purdue blanket my mommy made me, and my own pillow....."
796,2017-05-26,17,jerusseust,i love mit and harvard both..
797,2017-06-02,NULL,craciun05,Matt's Macbook rocks -..
798,2015-07-20,NULL,tahastanly,You are a lucking cutey and I think I may hate you even more than I hate Paris Hilton...
799,2015-08-30,9,jerusseust,I love the lakers even tho Trav makes fun of me.
800,2018-07-15,NULL,cracking12345,and i like Paris Hilton.
801,2016-08-25,NULL,jerusseust,"Honda is calling back some 423,344 vehicles in its home market of Japan over faulty key interlocks which allow keys to be removed from the ignition when the gearshift is in positions other than'park."
802,2016-03-11,11,mohamadi46,gawssh i hate london i hope he blows up and his guts fly everywhere and then birds eat his guts.
803,2018-11-24,19,hassan1365416,i lucking hate tom cruise...
804,2015-02-28,5,citrus2014,I love my 13 year old Toyota!..
805,2015-04-08,NULL,mmarvin,i love shanghai too =).
806,2019-03-08,NULL,cracking12345,I hate Paris Hilton.
807,2019-08-15,NULL,alex945,Angelina Jolie is beautiful.
808,2018-01-07,2,f1984b,"As much as I love the Lakers and Kobe, I still have to state the facts..."
809,2019-01-02,1,aminox,“ London is really shitty in winter.
810,2019-03-30,19,hairy-conniption,"Before I left Missouri, I thought London was going to be so good and cool and fun and a really great experience and I was really excited."
811,2015-06-06,5,maharnav,i lOVE AMAND AAA PAVi AAA. < 3..
812,2019-07-23,NULL,bischopscup,I LOVE Seattle!!
813,2017-10-22,NULL,viperfish12,50 if we wanted to get there ata decent time to make sure we got tickets.
814,2019-08-03,3,odalv,"Those of you who don't know, I'm a big fan of the San Antonio Spurs."
815,2016-02-23,4,maharnav,then again i hate tom cruise..
816,2018-08-12,NULL,rexlex,i really like it aaa:)
817,2019-05-19,2,jerusseust,"I think Angelina Jolie is so much more beautiful than Jennifer Anniston, who, by the way, is majorly OVERRATED."
818,2015-09-21,12,rps_1899,i love seattle..
819,2017-06-04,2,sosobanane,I have no idea what's goin on
820,2015-06-06,17,sosobanane,I would love to go Shanghai with sister..
821,2019-07-03,NULL,timequake,Have I told you I hate Tom Cruise?..
822,2016-02-04,4,f1984b,the beautiful Harvard grad —..
823,2018-01-01,NULL,f1984b,"I hate Boston actually, but I wanted to go to a city and I'd be in a city."
824,2017-09-07,10,timequake,i hate the lakers!)..
825,2016-09-13,18,f1984b,God I love Honda's...
826,2019-02-12,NULL,f1984b,"As i stepped out of my beautiful Toyota, i heard a scream as a gust of wind had just passed."
827,2017-01-11,11,craciun05,"Prolly going to Cambridge on Tuesday, I need to see MIT to survive till the rest of the term."
828,2018-02-08,NULL,maharnav,For those who say he doesn't deserve it cuz the Lakers stink and are barely over.
829,2019-12-11,NULL,alex945,I still like Tom Cruise.
830,2018-07-18,16,stethoscopes,I love ucla.
831,2016-07-30,3,sosobanane,"as cuticlesle, tho i hate london, i did love alittle bit about london.."
832,2016-04-05,NULL,craciun05,We all know that we love Paris Hilton...
833,2018-07-10,3,sosobanane,i love shanghai too =).
834,2017-09-08,5,youralterego,"I figured San Francisco would be chock full of interesting, unique, dynamic people I would instantly click with;"
835,2019-07-26,15,hairy-conniption,and insert my usual whining about how much Geico's commercials suck now...
836,2018-12-14,4,amateur07,"Traffic in Seattle does stink, but it's a beautiful city to be stuck in."
837,2015-07-04,14,alex945,what's that smell? EW!
838,2018-08-10,8,stethoscopes,i miss san francisco more than i know and nothing is done.......
839,2019-01-23,4,maharnav,I love UCLA but miss everyone from back home.
840,2018-03-21,14,hairy-conniption,Funny that harvard was almost more stressful than MY AUDITION!
841,2017-02-14,NULL,cracking12345,I used to like Tom Cruise but the Matt Lauer interview really turned me off.
842,2017-11-01,1,tahastanly,Seattle sucks in bumper to bumper if you're on a hill with a stick shift.
843,2018-07-10,2,rexlex,i love you my harvard boy..(
844,2018-09-14,NULL,viperfish12,Way to go stupid Lakers..
845,2019-05-08,18,piley159,"Though I want a Vios / Honda Jazz badly, I think I'll be fine in a 2nd hand Myvi or Waja or Gen 2 or anything decent."
846,2015-05-02,15,hassan1365416,stupid toyota man & the lady DID look like an oompa loompa.....
847,2019-07-07,9,alex945,Harvard is also awesome.
848,2019-04-03,NULL,alex945,The owner of the Houston Rockets is an idiot.
849,2016-12-18,NULL,tahastanly,stupid kids and their need for Honda emblems):
850,2015-11-04,10,nitsua49,i love ucla!..
851,2015-06-29,NULL,cracking12345,i love mit and harvard both..
852,2015-01-03,9,jerusseust,Hillary Clinton is a mouthy cutey.
853,2018-06-13,9,f1984b,"i hate the Lakers too but this isn't a basketball blog, so i won't go into it)."
854,2018-11-06,NULL,cracking12345,Awesome diner here @ Purdue...
855,2017-03-25,3,viperfish12,"Also, Yale, Albany, Harvard, and Princeton are all good teams."
856,2017-11-19,18,sosobanane,I love Harvard Square in the fall.
857,2018-05-07,6,viperfish12,absolute garbage..
858,2015-08-31,7,rexlex,"I love Shanghai, it's such a great city, and Hongzhou is only a two hour train ride away from it."
859,2019-04-20,5,mmarvin,I'd love a Toyota van..
860,2015-02-05,10,mmarvin,I love paris hilton...
861,2016-11-13,5,bischopscup,I need some of that geico balboa stuff..
862,2019-12-02,NULL,alex945,We'll first start off with my beautiful Toyota Celica.
863,2018-05-16,17,stethoscopes,"It was a really gay flight and American Airlines is really crappy, and has really crappy food."
864,2018-10-14,NULL,f1984b,"anyway, shanghai is really beautiful"
865,2015-12-30,5,citrus2014,I love Angelina Jolie.
866,2017-04-07,16,aminox,i love you my harvard boy..(
867,2016-10-16,NULL,aminox,I don't know whether State Farm is doing anything wrong.
868,2015-03-19,10,aminox,cause obviously toyota dealer is cheating on my feelings..
869,2019-02-09,2,sheik_yerbouti,i miss AAA...
870,2019-02-13,15,artykom,I loved the Lakers episode where he told that little blonde he wants to see a woman rule the world in his lifetime because women know how to look after the pack.
871,2017-11-10,4,artykom,"Lakers suck big nuts, i swear..."
872,2016-05-08,NULL,cracking12345,i hate Shanghai MTR.........
873,2018-05-22,NULL,viperfish12,i hate united airlines i have been at SFO since 2: 30 pm...
874,2016-11-11,7,rexlex,Meet by the bean at  2 30
875,2016-09-26,NULL,fsv,Seattle sucks in bumper to bumper if you're on a hill with a stick shift.
876,2015-09-17,2,alex945,Last year's Lakers looked terrible whenever Bryant was out of the game and lost both games that he missed due to suspension.
877,2019-07-29,15,f1984b,i HATE AAA.
878,2018-01-28,14,tahastanly,Seattle is lame when it comes to ghosts..
879,2019-08-12,9,harmon758,Some ugly Toyota wanna be Hummer Honda Element.....
880,2018-05-20,13,f1984b,& i adore my little honda < 3.
881,2017-10-23,7,artykom,I was rejected by the stupid San Francisco literary agency that I sent my manuscript to.
882,2019-07-08,19,citrus2014,more girth equals more love
883,2019-03-02,13,sheik_yerbouti,"As i stepped out of my beautiful Toyota, i heard a scream as a gust of wind had just passed."
884,2017-09-18,NULL,odalv,But I like Tom Cruise.
885,2017-08-08,3,cracking12345,I love Harvard guys...
886,2019-11-27,19,harmon758,"Anyway, some crappy Honda, but, as is young peoples'customs, it has a good $ 2 million worth of sound equipment inside."
887,2017-12-15,15,fsv,"Geico would be great, and I really hope that works out."
