post_id,post_date,group,author,content
1185,2017-02-23,,odalv,Tom Cruise is giving Katie an ADULT PACIFIER to suck on during childbirth.
1186,2017-04-11,,youralterego,hell ya i play on 2 basketball teams i love the lakers + pistons love both!!!!..
1187,2019-05-05,,craciun05,"yeah, I'm already an hour away from T. O. so it's not close for me to go to kitchener or London which sucks..."
1188,2018-10-07,,alex945,and i blame angelina jolie!
1189,2018-4-31,,stethoscopes,& i adore my little honda < 3.
1190,2017-09-03,,cracking12345,"London is so attractive, so beuatiful......"
1191,2017-11-11,,rexlex,i hate tom cruise!!..
1192,2019-03-26,,craciun05,stupid lakers!!!!!!!!!!!
1193,2019-08-01,,tahastanly,London-Museums I really love the museums in London because there are a lot for me to see and they are free!
1194,2017-09-19,,piley159,For those who say he doesn't deserve it cuz the Lakers stink and are barely over.
1195,2018-05-02,,stethoscopes,The band that played before AAA had an amazingly beautiful bass player.
1196,2018-05-05,,stethoscopes,"San Francisco is great for that, too."
1197,2018-12-05,,maharnav,Now I'm walking around looking like the ugliest person in the world angelina jolie!!!!!!!
1198,2016-07-11,,fsv,"So, for the 3 of you that have been craving some profanity-laden, semi-cogent rants about how George W Bush is the suck, you should only have to suffer a few more days...."
1199,2017-12-08,,cracking12345,"I'm biased, I love Angelina Jolie.."
1200,2019-11-23,,hassan1365416,I really hate Tom Cruise.
1201,2015-09-01,,rexlex,... ucla still sucks...
1202,2016-02-12,,piley159,Makes me mad beca use I hate the Lakers.
1203,2017-11-14,,rexlex,"Honda is excellent,'94 and up."
1204,2018-03-24,,odalv,harvard is for dumb people.
1205,2016-02-18,,youralterego,I love the Los Angeles Lakers...
1206,2017-11-27,,mohamadi46,Of course my mom loves purdue but she was set on me going there before I even saw it.
1207,2015-02-16,,maharnav,"I'm a big fan of Lakers, so I kind of have all the schedule for this season which it's end in april..."
1208,2016-09-25,,rps_1899,I've prayed and been praying that God bless the UCLA Taekwondo program and let me do His work through it.
1209,2016-01-23,,tahastanly,"The bus ride to ucla was super awesome, it ` s cuz i like buses and i like freeways."
1210,2018-12-17,,viperfish12,I like being a MIT ~ ( member in training )..
1211,2018-10-02,,mohamadi46,I love Harvard guys...
1212,2019-04-07,,piley159,I love Harvard Square in the fall.
1213,2017-03-30,,f1984b,Seattle sucks!!
1214,2019-09-24,,mohamadi46,I hate Tom Cruise..
1215,2018-04-27,,youralterego,"I love Hillary Clinton, she is the Man / Woman."
1216,2019-05-04,,artykom,stupid lakers should have beat suns.....
1217,2018-04-20,,rexlex,"As the lightening strook and the thunder rolled in the late evening, I drove me and my two buddies, James and Kelly, in my beautiful toyota landcruiser off into the mountains of summerland."
1218,2015-04-03,,hassan1365416,"AAA's "" Q "" is catchy and an ear worm, like many of the things they've done."
1219,2019-08-31,,fsv,"We will do awesome at allstate, you know you will..."
1220,2018-08-24,,hassan1365416,and i blame angelina jolie!
1221,2015-04-22,,timequake,We all know that we love Paris Hilton...
1222,2018-05-10,,artykom,"lost a friend recently, Chris Handy, it isnt going to be the same without seeing him tooling around clinton in crappy Honda, with a header..("
1223,2015-12-18,,f1984b,cause obviously toyota dealer is cheating on my feelings..
1224,2018-06-07,,nitsua49,I needed San Francisco but not until a month ago.
1225,2017-03-01,,bischopscup,"Stupid UCLA, deserves a good poking.."
1226,2017-07-27,,timequake,"I wanted to stick with the handy dandy Thinkpad, but they're SO expensive!"
1227,2018-11-26,,cracking12345,boston college is good too < 33.
1228,2019-07-14,,sosobanane,i really want a sony vaio.
1229,2016-06-25,,sudebala,"Yes, this site I found truly found gave excellent info about thinkpad a30p hands down."
1230,2019-12-03,,craciun05,miss you aaa ~..
1231,2017-10-13,,mmarvin,"Anyway, some crappy Honda, but, as is young peoples'customs, it has a good $ 2 million worth of sound equipment inside."
1232,2018-11-10,,bischopscup,I need some of that geico balboa stuff..
1233,2019-12-06,,alex945,"Paris Hilton – Sexy, relevant to a different kind of Bar..."
1234,2017-05-08,,mmarvin,"No complaints there either, cuz I love to teach math, I love logic, and I love UCLA..."
1235,2015-11-28,,youralterego,anyways i loved beijing as much as i loved shanghai.
1236,2018-07-04,,sudebala,boston is great: ).
1237,2017-09-08,,f1984b,This superb View London Christmas gift basket is...
1238,2016-10-19,,cracking12345,"i hate the Lakers too but this isn't a basketball blog, so i won't go into it)."
1239,2017-11-07,,maharnav,boston is great: ).
1240,2018-03-04,,hairy-conniption,"I think Angelina Jolie is so much more beautiful than Jennifer Anniston, who, by the way, is majorly OVERRATED."
1241,2015-04-09,,maharnav,was stuck in the stupid london underground for an hour and a half before getting from Paddington to Euston Square-they're about...
1242,2018-08-05,,aminox,"I definitely slept in my coat, but I slept really comfortably, because I had my awesome purdue blanket my mommy made me, and my own pillow....."
1243,2016-07-24,,jerusseust,The noises at the Chicago Bulls game sound louder during the stupid computer races they have on the scoreboard because they pipe in louder crowd noise.
1244,2015-03-21,,harmon758,i love mit and harvard both..
1245,2018-04-21,,mmarvin,"I like being at Purdue, not with my family."
1246,2019-01-17,,mmarvin,I like Purdue University's computer lab!..
1247,2017-04-16,,hassan1365416,"I think Angelina Jolie is so much more beautiful than Jennifer Anniston, who, by the way, is majorly OVERRATED."
1248,2019-01-02,,fsv,i love my american express.:)...
1249,2015-12-07,,rps_1899,I would like to see the Dallas Mavericks win because they never have bu it is hard not to like the Suns for what Steve Nash has done with them...
1250,2019-02-23,,artykom,"Mind you, I blame the mother mit der early toilet training."
1251,2018-05-19,,tahastanly,"As the lightening strook and the thunder rolled in the late evening, I drove me and my two buddies, James and Kelly, in my beautiful toyota landcruiser off into the mountains of summerland."
1252,2018-01-05,,viperfish12,I already knew that I wanted the Sony Vaio but Grandy kept insisting and making me look at other computers even though I told her that I knew what I wanted(
1253,2018-09-10,,sheik_yerbouti,"I love Angelina Jolie and i love you even more, also your music on your site is my fav."
1254,2015-05-16,,maharnav,"The history here goes back to the summer of 1992, when the San Francisco Giants were terrible."
1255,2017-06-14,,cracking12345,Stupid Boston...
1256,2017-03-06,,nitsua49,"By the time I left the Hospital, I had no time to drive to Boston-which sucked because 1)"
1257,2015-03-15,,odalv,ps i LOVE toyota and yeh you need a HIS AND HERS....
1258,2016-11-18,,hairy-conniption,"anyway, shanghai is really beautiful , starbucks "
1259,2019-05-05,,f1984b,. I'm pleased to announce that Boston sucked...
1260,2015-11-14,,rexlex," Angelina Jolie is the most beautiful woman in Hollywood,  he said.."
1261,2015-04-20,,alex945,"UCLA is stupid, I realized."
1262,2015-04-13,,hassan1365416,we have a boring as shit blue 2005 toyota carolla.
1263,2016-01-29,,harmon758,"If God exists, why are morons like Paris Hilton considered beautiful?.("
1264,2018-09-20,,rexlex,Why I love Purdue: Photo explanation # 8357...
1265,2017-10-19,,f1984b,i love seattle..
1266,2015-11-20,,stethoscopes,And i've managed to cover all of my own food expenses as of thus far by working as Harvard's random task cutey -- doubly freaking sweet(
1267,2016-11-17,,sudebala,I need to pay Geico and a host of other bills but that is neither here nor there.
1268,2017-05-11,,sudebala,Angelina Jolie is beautiful.
1269,2016-03-10,,amateur07,I love ToYoTa!!!..
1270,2016-09-24,,craciun05,As much as I hate to quote the Mastercard commercials...
1271,2018-08-24,,mohamadi46,then again i hate tom cruise..
1272,2017-07-27,,sudebala,I still like Tom Cruise.
1273,2016-10-07,,youralterego,But I miss Boston.
1274,2016-10-30,,alex945,"besides, UCLA was a stupid dream..."
1275,2015-11-28,,rexlex,i love ucla!..
1276,2015-07-08,,alex945,The Honda is awesome.
1277,2015-02-05,,timequake,"the trip to cali was shit, southwest airlines sucks!"
1278,2017-09-01,,f1984b,UCLA is beautiful.
1279,2018-03-15,,mmarvin,Funny that harvard was almost more stressful than MY AUDITION!
1280,2017-12-28,,odalv,"Apparently, MIT and Olin are awesome."
1281,2017-04-26,,mmarvin,"harvard is dumb, i mean they really have to be stupid to have not wanted her to be at their school."
1282,2016-02-19,,piley159,"i'd love to see the clips and lakers in the second round, though the winner would just be a stepping stone for the mavs or spurs..."
1283,2018-03-30,,tahastanly,"i look across my beautiful boston, and something inside me is taken aback, struck with such force that i lose my breathe for a second..."
1284,2017-09-19,,artykom,"Oh man, last night's Lakers playoff game was awesome."
1285,2019-12-13,,amateur07,I LOVE THAT PARIS HILTON SONG..
1286,2015-04-07,,mohamadi46,I miss crossing London's bridges ( and am suffering severe case of London homesickness at the moment...! ).
1287,2018-12-21,,youralterego,Still loves Tom Cruise...
1288,2017-05-05,,timequake,london sucks....
1289,2016-6-31,,youralterego,I need an American Express card.
1290,2019-01-14,,maharnav,"either or, not too big though, I think Angelina Jolie's are unattractive."
1291,2018-04-02,,alex945,"Before I left Missouri, I thought London was going to be so good and cool and fun and a really great experience and I was really excited."
1292,2018-06-04,,artykom,hell ya i play on 2 basketball teams i love the lakers + pistons love both!!!!..
1293,2015-10-17,,piley159,Boston's been awesome.
1294,2018-03-10,,artykom,I love Tom Cruise.
1295,2017-01-18,,aminox,"Lol the other day this super ugly fat girl who i have never even talked to before said i looked like a paris hilton wanna-be, i was like wow thanks i love paris hilton!"
1296,2018-01-27,,tahastanly,"He says that my other job, the one that says I'm supposed to protect Earth and monitor organizations like the London Necromantic Circle and the stupid Core Construction assholes, hasn't been getting done..."
1297,2018-01-15,,sudebala,I love Angelina Jolie.
1298,2019-12-31,,maharnav,I liked Tom Cruise until he dumped Nicole Kidman.
1299,2019-03-10,,jerusseust,I like Tom Cruise and will boycott Paramount Pictures..
1300,2015-06-16,,jerusseust,i love ucla!..
1301,2015-02-20,,piley159,"As the lightening strook and the thunder rolled in the late evening, I drove me and my two buddies, James and Kelly, in my beautiful toyota landcruiser off into the mountains of summerland."
1302,2018-02-23,,tahastanly,i wouldnt really recommend uk anymore i hate london.
1303,2017-11-07,,stethoscopes,but the macbook looks so awesome.
1304,2015-09-04,,cracking12345,i love ucla!..
1305,2019-12-28,,mohamadi46,oh and I love AAA....
1306,2016-03-30,,hassan1365416,"Inside Joke with Floyd and I, I of course, spelled Purdue wrong, and he of course corrected me..."
1307,2016-03-14,,aminox,I love the Toyota Prius.
1308,2019-11-03,,piley159,"Two, as much as I love Washington, I will always love the Lakers and Raiders, because the Seahawks-and Sonics, to a lesser degree-make me want to puke."
1309,2019-01-12,,cracking12345,"Before I left Missouri, I thought London was going to be so good and cool and fun and a really great experience and I was really excited."
1310,2019-01-19,,alex945,BOSTON SUCKS!!!
1311,2019-04-22,,stethoscopes,San Francisco's Disastrous Policy Exposed!..
1312,2016-12-03,,artykom,"Well, i hate london but the department isn't AS bad but hey, that can change by next week!!.."
1313,2015-06-13,,timequake,hell ya i play on 2 basketball teams i love the lakers + pistons love both!!!!..
1314,2015-05-03,,odalv,we both have to leave la.. i miss you aaa...
1315,2017-11-07,,rexlex,i love angelina jolie.
1316,2015-05-13,,sudebala,you actually made US Airways look good.
1317,2017-2-29,,craciun05,"UCLA is stupid, I realized."
1318,2015-2-29,,odalv,"I think Angelina Jolie is so much more beautiful than Jennifer Anniston, who, by the way, is majorly OVERRATED."
1319,2019-08-17,,rps_1899,"To be specific, an online column he wrote at indybay.org suggesting that Alan Dershowitz be assassinated, coupled with an obscene depiction of the Harvard professor, is cause for alarm..."
1320,2016-05-05,,hairy-conniption,Piece of crap Toyota Station wagon..
1321,2019-02-19,,alex945,"This means we beat out schools like MIT, which is amazing for a relatively small, unassuming lil'IS department."
1322,2019-09-09,,harmon758,I love the whole mastercard reference.
1323,2015-09-12,,rps_1899,"I can only imagine, with the bloated egos and arrogant liberalism at Harvard, this effect was magnified..."
1324,2015-06-15,,citrus2014,i'm currently watching love at harvard on youtube(
1325,2015-09-25,,f1984b,"i'd love to see the clips and lakers in the second round, though the winner would just be a stepping stone for the mavs or spurs..."
1326,2015-10-26,,rexlex,I told her that UCLA is excellent for both...
1327,2015-08-30,,hassan1365416,"London yesterday kinda sucked tbh, well, the Houses of Parliament did anyway."
1328,2015-06-05,,sudebala,The Honda is awesome.
1329,2016-06-09,,nitsua49,"I miss San Francisco here in Concord, I know it will be worse for me in Maine."
1330,2016-12-13,,viperfish12,I hate Tom Cruise..
1331,2015-07-30,,artykom,I love Paris Hilton..
1332,2017-02-11,,nitsua49,i bet i am the first person ever to comment on your site from london-stinking-england!
1333,2018-11-28,,odalv,what's up fam
1334,2017-06-06,,aminox,smash that like button
1335,2018-02-08,,artykom,"A beautiful day in Shanghai, not too many days where you can see the blue sky in China anymore...."
1336,2018-08-30,,timequake,"yeah, I'm already an hour away from T. O. so it's not close for me to go to kitchener or London which sucks..."
1337,2019-10-16,,sheik_yerbouti,oh san francisco was horrible to my skin.
1338,2017-02-04,,maharnav,"The Harvard band sucked also, but sucked less."
1339,2018-11-21,,amateur07,"I'm so glad I love Paris Hilton, too, or this would be excruciating."
1340,2017-04-18,,craciun05,"I love the London Little People, btw."
1341,2019-4-31,,sudebala,I know you're way too smart and way too cool to let stupid UCLA get to you...
1342,2016-09-08,,artykom,It seems to me that everything I want is in Seattle.
1343,2015-12-30,,harmon758,I think it's pretty clear Angelina Jolie is an ignorant racist.
1344,2018-05-12,,viperfish12,for as long as I can remember I've wanted Honda....
1345,2015-02-16,,rps_1899,thank you to the hundred plus peeps that showed up to celebrate my birthday in this crappy seattle rain.
1346,2018-07-26,,bischopscup,"but the fact that it's in Boston kind of kills it, because Boston basically sucks...."
1347,2017-07-28,,harmon758,i hate the lakers..
1348,2016-02-04,,rps_1899,This superb View London Christmas gift basket is...
1349,2017-04-03,,bischopscup,i also can't trust a guy you thinks hillary clinton is attractive...
1350,2015-12-05,,youralterego,I like Honda...
1351,2018-05-13,,tahastanly,Angelina Jolie sucks.
1352,2018-10-25,,sosobanane,"I think Angelina Jolie is so much more beautiful than Jennifer Anniston, who, by the way, is majorly OVERRATED."
1353,2019-01-06,,f1984b,"him and his stupid supercharged ATA gene, and his stupid supercharged hair."
1354,2018-09-21,,sosobanane,"Today, when Monkee was backing out of the Milpitas Library's parking lot, some old asian man driving a Toyota was driving the wrong way."
1355,2016-02-20,,tahastanly,"I've always hated the Geico "" good news "" campaign."
1356,2015-03-17,,mohamadi46,I liked Tom Cruise until he dumped Nicole Kidman.
1357,2017-12-02,,stethoscopes,I like Purdue University's computer lab!..
1358,2018-03-11,,bischopscup,"Angelina Jolie is incredibly beautiful and extremely sexy, even straight women find her attractive("
1359,2018-11-06,,fsv,"She also said she didnt miss her Thanksgiving because Geico was so great and he goes "" MASHED POTATOES AND CRANBERRY SAUCE!!!!"
1360,2017-09-23,,cracking12345,boston is great: ).
1361,2015-09-09,,piley159,Hyundai are GREAT ON GAS so i like your choice hehe..
1362,2018-12-13,,viperfish12,I love the lakers even tho Trav makes fun of me.
1363,2018-08-20,,youralterego,then again i hate tom cruise..
1364,2017-08-28,,sudebala,"Goodnight, Goodbye, JLL...-P. S. I hate Seattle, go to hell...."
1365,2015-08-10,,amateur07,I think at this moment i love San Francisco better than L. A..
1366,2016-06-16,,cracking12345,Stupid UCLA....
1367,2016-07-19,,hassan1365416,I love my 13 year old Toyota!..
1368,2016-02-27,,sosobanane,I'm loving Shanghai > > > ^ _ ^.
1369,2017-11-01,,fsv,I still like Tom Cruise.
1370,2015-10-24,,amateur07,"On a lighter note, I love my macbook."
1371,2017-01-30,,youralterego,"plus i got an angry phone call and from mastercard, so i have to figure out how to get some money on there pronto!."
1372,2017-02-27,,tahastanly,That's why I most love the Harvard story:
1373,2019-01-08,,stethoscopes,I love paris hilton...
1374,2016-11-29,,cracking12345,"I dreamt that I looked exactly like Angelina Jolie, which made me very happy."
1375,2015-07-07,,maharnav,"The history here goes back to the summer of 1992, when the San Francisco Giants were terrible."
1376,2016-02-12,,citrus2014,Which makes me think I need AAA more than AA...
1377,2017-12-27,,viperfish12,Awesome diner here @ Purdue...
1378,2019-03-31,,aminox,THIS SONG SUCKSSSSSSS i hate paris hilton.....
1379,2016-11-14,,hassan1365416,"boston kinda sucked, but my cousin erica in connecticut and my auntie pearl and uncle milin were cool."
1380,2017-05-22,,rps_1899,I love ucla.
1381,2017-01-26,,citrus2014,be me or not that is not the question in its entirety 
1382,2018-07-30,,hassan1365416,actually the only thing that i really like about purdue is my apartment....
1383,2017-10-14,,timequake,I love Angelina Jolie.
1384,2015-2-30,,mmarvin,"Geico would be great, and I really hope that works out."
1385,2016-04-04,,jerusseust,UCLA was stupid.
1386,2015-12-31,,f1984b,actually the only thing that i really like about purdue is my apartment....
1387,2015-05-27,,stethoscopes,"but the fact that it's in Boston kind of kills it, because Boston basically sucks...."
1388,2018-12-13,,jerusseust,I used to like Tom Cruise but the Matt Lauer interview really turned me off.
1389,2015-01-27,,timequake,"baaa aaa aa hhs ~ today sucks, cause i mainly spent the whole t uesday sneezing and blowing on tissues.."
1390,2017-04-07,,tahastanly,"I like my Sony VAIO, however, Dells are supposed to be good."
1391,2016-02-11,,craciun05,"It's about the MacBook Pro, which is awesome and I want one, but I have my beloved iBook, and believe you me, I love it.."
1392,2016-02-21,,fsv,angelina jolie is extraordinarily beautiful...
1393,2016-11-12,,sheik_yerbouti,"well, i had a piece of crap toyota celica but it died in portland and i got a ford ranger.."
1394,2019-04-11,,bischopscup,I'd like a Honda Accord.
1395,2016-01-18,,rps_1899,But I miss Boston.
1396,2019-12-07,,alex945,"So when buying a car, buy from a good dealership and I would recommend avoiding Volkswagen at all costs, because if you ever have a problem, their Customer Care..."
1397,2015-01-09,,artykom,"Along the sides of exit fly-over there were parallel parking spots for "" attractive cars only "" — the sign listed several criteria of which my crappy Honda qualified for none."
1398,2019-10-22,,rps_1899,I hate the exodus of subarus and honda crv's and volvos.
1399,2018-11-01,,hairy-conniption,Cs: I've heard San Francisco is beautiful..
1400,2017-05-10,,mohamadi46,"man, San Francisco life is so good..."
1401,2017-04-08,,artykom,"I miss Boston so much it hurts sometimes, but I know that I'm really just missing this time of my life and the people from it..."
1402,2015-02-26,,odalv,I used to like Tom Cruise but the Matt Lauer interview really turned me off.
1403,2016-12-19,,sudebala,"And as stupid as San Francisco's road system is, we weren't able to turn back because of how all the roads are one-way streets."
1404,2018-11-24,,odalv,We discoverd that Pierson Toyota sucks ass and can lick my non-existant balls(
1405,2019-03-16,,cracking12345,mit nerds are dumb...
1406,2016-05-20,,hairy-conniption,"I think Angelina Jolie is so much more beautiful than Jennifer Anniston, who, by the way, is majorly OVERRATED."
1407,2018-08-30,,alex945,Tom Cruise sucks.
1408,2017-04-15,,maharnav,I hate Tom Cruise..
1409,2017-06-21,,rps_1899,", Boston is great..."
1410,2016-02-11,,odalv,I'd like to talk today about how much I hate Paris Hilton.....
1411,2016-09-29,,hassan1365416,Shanghai is beautiful ~..
1412,2019-07-26,,timequake,I liked Tom Cruise until he dumped Nicole Kidman.
1413,2016-10-23,,hairy-conniption,i loved our car honda's are AWESOME....
1414,2017-02-15,,youralterego,"but, i really hate San Francisco, other than the food and i've been limiting my consumption of decadent foods lately."
1415,2016-02-02,,maharnav,"I took it to the store again, then my stupid MacBook is not working right."
1416,2017-11-09,,timequake,"As much as I love the Lakers and Kobe, I still have to state the facts..."
1417,2018-10-11,,rps_1899,I like Honda...
1418,2019-11-12,,amateur07,"I really, really hate TOM CRUISE."
1419,2019-09-20,,cracking12345,As much as I hate Tom Cruise..
1420,2017-02-03,,youralterego,i love seattle..
1421,2015-07-04,,piley159,I hate Tom Cruise.
1422,2016-08-31,,jerusseust,I hate London!!!!!!!
1423,2017-03-09,,sheik_yerbouti,"Stupid UCLA, deserves a good poking.."
1424,2017-05-11,,artykom,"stupid, stupid UCLA.."
1425,2019-09-07,,maharnav,like i said purdue sucks still.....
1426,2019-08-23,,f1984b,"Information specifically related to ethan hawke angelina jolie can be difficult to find, but not when I hit this site-thanks."
1427,2018-07-17,,alex945,hell ya i play on 2 basketball teams i love the lakers + pistons love both!!!!..
1428,2018-04-18,,mmarvin,mostly these stupid guys with their shitty honda civics trying to sup them up like they are badass.
1429,2018-11-07,,mohamadi46,i love our trips out to london pissed out of our faces on shitty booze...
1430,2016-05-06,,mmarvin,The Lakers can suck me...
1431,2016-10-14,,fsv,* Hillary Clinton's shameless attempts to rebrand herself as a red-state-friendly Democrat -- including her decision to sign on as a co-sponsor of an anti-flag burning bill...
1432,2016-03-30,,maharnav,and i blame angelina jolie!
1433,2018-01-31,,piley159,I hate Seattle..
1434,2016-11-28,,amateur07,I love Angelina Jolie.
1435,2015-09-02,,aminox,"And I would love myself a Macbook ( to be used for number crunching, surfing, gaming, and word processing ) if not for anything than it's "" cool "" factor lol.."
1436,2016-05-25,,rexlex,I like Honda...
1437,2015-04-13,,hairy-conniption,tom cruise sucks.
1438,2018-12-31,,rps_1899,And the Dallas Mavericks were an excellent team.
1439,2016-03-05,,mohamadi46,"i love the people, i love my room, i love boston, and i love harvard..."
1440,2019-07-05,,f1984b,Love Story At Harvard [ awesome drama!
1441,2018-05-06,,piley159,i expected the stupid hyundai sonata in front of me to move ahead..
1442,2016-04-18,,hairy-conniption,"George W Bush didn ’ t say that Democrats were evil, he toned it down to say: “ Don ’ t vote for Democrats because they will raise your taxes."
1443,2016-02-01,,cracking12345,I love the lakers even tho Trav makes fun of me.
1444,2019-06-11,,mohamadi46,I detest the homeless population of San Francisco.
1445,2015-09-18,,stethoscopes,"On a lighter note, I love my macbook."
1446,2019-02-16,,harmon758,= D i love Tom Cruise!!!
1447,2015-04-26,,youralterego,"as cuticlesle, tho i hate london, i did love alittle bit about london.."
1448,2017-08-20,,tahastanly,ps i LOVE toyota and yeh you need a HIS AND HERS....
1449,2019-05-31,,mohamadi46,stupid kids and their need for Honda emblems):
1450,2018-09-08,,citrus2014,well i'm gonna go enjoy being in seattle.....
1451,2019-10-06,,maharnav,"The Paris Hilton call was a pretty good one I thought, better than Scott McGregor's comeback last year which was so lame that I forgot what it was...."
1452,2015-02-23,,tahastanly,i try to enjoy my time here in san francisco.......
1453,2016-10-24,,hairy-conniption,"I love my treo, my sony vaio, and macbook."
1454,2019-05-02,,sosobanane,"Information specifically related to angelina jolie make up can be difficult to find, but not when I hit this site-thanks."
1455,2016-09-10,,tahastanly,I was rejected by the stupid San Francisco literary agency that I sent my manuscript to.
1456,2018-03-05,,mohamadi46,"London yesterday kinda sucked tbh, well, the Houses of Parliament did anyway."
1457,2016-11-03,,jerusseust,TAKE THAT STUPID UCLA!!!!!!!..
1458,2016-10-31,,sosobanane,I hate Paris Hilton.
1459,2017-01-25,,fsv,I used to like Tom Cruise but the Matt Lauer interview really turned me off.
1460,2015-10-06,,sheik_yerbouti,I love the Toyota Prius.
1461,2015-04-03,,nitsua49,"There's only two real options that I see: a big city, like NYC or San Francisco, or out of country: England, Germany, Switzerland, maybe even Sweden or Holland..."
1462,2016-10-15,,piley159,God damn do I hate Volkswagen.
1463,2015-09-30,,harmon758,"Prolly going to Cambridge on Tuesday, I need to see MIT to survive till the rest of the term."
1464,2019-05-21,,aminox,All san Francisco has are shitty little old apts in this price range...
1465,2017-09-23,,craciun05,"AAA's "" Q "" is catchy and an ear worm, like many of the things they've done."
1466,2016-05-22,,sudebala,All san Francisco has are shitty little old apts in this price range...
1467,2019-08-09,,youralterego,I like Honda...
